{
  "schema_version": "full_issue_universe_authority_receipt_v1",
  "receipt_id": "universe-authority:f000477:national_security_foreign:119:v1",
  "manifest_id": "cross-issue-universe-proposal:f000477:national_security_foreign:119:v1",
  "manifest_sha256": "1786abeac2ca8f6b6aa653e887f1ab22190d9821c0ed2119ee0ad02c323c86fc",
  "member_id": "F000477",
  "issue_id": "NATIONAL_SECURITY_FOREIGN",
  "review_scope": "full_defined_issue_record",
  "boundary": {
    "sessions": [
      1,
      2
    ],
    "start_date": "2025-01-03",
    "end_date": "2026-07-23",
    "as_of_date": "2026-08-09",
    "chambers": [
      "house"
    ],
    "service_boundary": "Valerie Foushee (F000477) is represented as the serving NC-04 House member throughout the included 119th-Congress action dates; the governed official record covers House actions through July 23, 2026."
  },
  "boundary_sha256": "fff3887fe425f1a8d570e13ebe31e28c7ccf9686decadad982a13c0f87f39649",
  "action_set_sha256": "190bda45c25cd32ae0a6847c862f85837eafc4a82dfda237746a66467c550400",
  "action_count": 82,
  "source_manifest_identities": [
    "source-inventory:F000477:NATIONAL_SECURITY_FOREIGN:119:v1"
  ],
  "universe_subject_sha256": "b1e1a4588a4fcef6beb9dfd836ff5c2f32d8fdb340359f11453c6a0c947a17a5",
  "reviewer": {
    "reviewer_id": "dhart54",
    "authority": "full_issue_universe_review_authority_v1"
  },
  "decision_timestamp": "2026-08-09T03:45:32.2350019Z",
  "decision": "approved_complete_issue_universe",
  "approval_binding": {
    "authority_effect": "universe_membership_only",
    "subject": {
      "member_name": "Valerie Foushee",
      "member_id": "F000477",
      "legislator_id": "leg_valerie_p_foushee",
      "chamber": "house",
      "congress": 119,
      "issue_id": "NATIONAL_SECURITY_FOREIGN"
    },
    "selected_domain": "NATIONAL_SECURITY_FOREIGN",
    "official_cutoff": {
      "end_date": "2026-07-23",
      "latest_action_id": "house:119:2:283"
    },
    "complete_house_action_set": {
      "artifact_id": "house-action-set:F000477:119:through-house:119:2:283:v1",
      "action_count": 638,
      "action_set_sha256": "a4d228a74004de61f78827ef85bd5a59cb4f5c3dddf9b55e9e3e154a44cd7fde"
    },
    "selection": {
      "artifact_path": "docs/editorial/cross_issue_full_record_expansion_v1/domain_selection.json",
      "sha256": "a018b597705132f0e891c575af1dac4b880c31b0d98469f2f47001982dce0b81"
    },
    "universe_proposal": {
      "artifact_path": "docs/editorial/cross_issue_full_record_expansion_v1/selected_domain_universe_proposal.json",
      "file_sha256": "1786abeac2ca8f6b6aa653e887f1ab22190d9821c0ed2119ee0ad02c323c86fc",
      "universe_subject_sha256": "b1e1a4588a4fcef6beb9dfd836ff5c2f32d8fdb340359f11453c6a0c947a17a5"
    },
    "approved_action_ids": [
      "house:119:1:7",
      "house:119:1:36",
      "house:119:1:51",
      "house:119:1:89",
      "house:119:1:90",
      "house:119:1:99",
      "house:119:1:115",
      "house:119:1:116",
      "house:119:1:119",
      "house:119:1:132",
      "house:119:1:133",
      "house:119:1:172",
      "house:119:1:182",
      "house:119:1:208",
      "house:119:1:209",
      "house:119:1:210",
      "house:119:1:212",
      "house:119:1:219",
      "house:119:1:220",
      "house:119:1:244",
      "house:119:1:246",
      "house:119:1:248",
      "house:119:1:249",
      "house:119:1:250",
      "house:119:1:251",
      "house:119:1:252",
      "house:119:1:255",
      "house:119:1:257",
      "house:119:1:258",
      "house:119:1:259",
      "house:119:1:260",
      "house:119:1:262",
      "house:119:1:266",
      "house:119:1:269",
      "house:119:1:281",
      "house:119:1:286",
      "house:119:1:307",
      "house:119:1:320",
      "house:119:1:345",
      "house:119:1:346",
      "house:119:2:28",
      "house:119:2:48",
      "house:119:2:49",
      "house:119:2:50",
      "house:119:2:58",
      "house:119:2:85",
      "house:119:2:114",
      "house:119:2:120",
      "house:119:2:142",
      "house:119:2:155",
      "house:119:2:170",
      "house:119:2:174",
      "house:119:2:175",
      "house:119:2:180",
      "house:119:2:190",
      "house:119:2:191",
      "house:119:2:199",
      "house:119:2:201",
      "house:119:2:207",
      "house:119:2:221",
      "house:119:2:232",
      "house:119:2:234",
      "house:119:2:243",
      "house:119:2:244",
      "house:119:2:247",
      "house:119:2:248",
      "house:119:2:256",
      "house:119:2:259",
      "house:119:2:260",
      "house:119:2:261",
      "house:119:2:262",
      "house:119:2:263",
      "house:119:2:264",
      "house:119:2:265",
      "house:119:2:266",
      "house:119:2:268",
      "house:119:2:269",
      "house:119:2:273",
      "house:119:2:275",
      "house:119:2:276",
      "house:119:2:278",
      "house:119:2:282"
    ],
    "exclusion_categories": {
      "procedural_context": {
        "artifact_id": "action-set:f000477:national_security_foreign:119:procedural_context:v1",
        "action_count": 33,
        "action_set_sha256": "dc3a47eabf2e859ba55dfcd91887e1166c5f505405c8175653af46a1332a57e5",
        "action_ids": [
          "house:119:1:176",
          "house:119:1:177",
          "house:119:1:181",
          "house:119:1:194",
          "house:119:1:195",
          "house:119:1:197",
          "house:119:1:198",
          "house:119:1:211",
          "house:119:1:242",
          "house:119:1:243",
          "house:119:1:261",
          "house:119:1:263",
          "house:119:1:280",
          "house:119:1:319",
          "house:119:2:24",
          "house:119:2:25",
          "house:119:2:140",
          "house:119:2:141",
          "house:119:2:153",
          "house:119:2:158",
          "house:119:2:159",
          "house:119:2:189",
          "house:119:2:200",
          "house:119:2:206",
          "house:119:2:230",
          "house:119:2:231",
          "house:119:2:236",
          "house:119:2:237",
          "house:119:2:246",
          "house:119:2:249",
          "house:119:2:253",
          "house:119:2:254",
          "house:119:2:277"
        ]
      },
      "expressive_nonbinding_context": {
        "artifact_id": "action-set:f000477:national_security_foreign:119:expressive_nonbinding_context:v1",
        "action_count": 2,
        "action_set_sha256": "983e863b4602433d7cd2f7779451d8fafb9c7337daf7c5841b2735c2af461a74",
        "action_ids": [
          "house:119:2:84",
          "house:119:2:167"
        ]
      },
      "exact_action_ineligible": {
        "artifact_id": "action-set:f000477:national_security_foreign:119:exact_action_ineligible:v1",
        "action_count": 26,
        "action_set_sha256": "6af05fff47898f4b4e6c129978e208b178077f697aa02ba6041e7c53f3ce08f5",
        "action_ids": [
          "house:119:1:63",
          "house:119:1:180",
          "house:119:1:204",
          "house:119:1:205",
          "house:119:1:206",
          "house:119:1:207",
          "house:119:2:26",
          "house:119:2:27",
          "house:119:2:144",
          "house:119:2:145",
          "house:119:2:146",
          "house:119:2:147",
          "house:119:2:148",
          "house:119:2:149",
          "house:119:2:150",
          "house:119:2:151",
          "house:119:2:152",
          "house:119:2:154",
          "house:119:2:241",
          "house:119:2:242",
          "house:119:2:245",
          "house:119:2:255",
          "house:119:2:257",
          "house:119:2:258",
          "house:119:2:267",
          "house:119:2:274"
        ]
      },
      "boundary_review_required": {
        "artifact_id": "action-set:f000477:national_security_foreign:119:boundary_review_required:v1",
        "action_count": 6,
        "action_set_sha256": "f071e78c42130dd20c4c4c8190b29943ca8725be7bd82d451473177c1e37b7c0",
        "action_ids": [
          "house:119:1:245",
          "house:119:1:247",
          "house:119:1:253",
          "house:119:1:254",
          "house:119:1:256",
          "house:119:1:285"
        ]
      }
    },
    "source_inventory": {
      "artifact_id": "source-inventory:F000477:NATIONAL_SECURITY_FOREIGN:119:v1",
      "artifact_path": "docs/editorial/cross_issue_full_record_expansion_v1/source_inventory.json",
      "file_sha256": "d9db9241a0d9229829159598ab970d327e1f20d1e705cae652a81bc3f4ff8f90",
      "inventory_sha256": "c0e568396793f7fcca7fd5c70a6ad82fa32de4e289362568b785d02fc92124b5"
    },
    "accepted_pull_request": {
      "number": 133,
      "head_sha": "1860ef0fab3f65ffb303c5b74b380f41fe929421"
    },
    "downstream_authorizations": {
      "action_interpretation": false,
      "episode_acceptance": false,
      "semantic_ir": false,
      "synthesis": false,
      "public_wording": false,
      "publication": false,
      "production_persistence": false
    }
  }
}
